Institution Name,Category,Name of Financial Institution,Instituition Type,Categorization,Old Name,Date of New Name,Street Address,Area,State,Telephone Number(s),Website,Email,Fax,PostalAddress,country,Ownership Type,Other Information,Date Licensed
Bank of Agriculture (BOA),Development Finance Institutions,Bank of Agriculture (BOA),Development Finance,-,NIGERIA AGRICULTURAL COOPERATIVE AND RURAL DEVELOPMENT,11/06/2007,"Yakubu Gowan Way, PMB 21555, Kaduna",Kaduna,KAD,8023101946,-,-,-,"PMB 21555, Kaduna",NGN,-,-,6/11/2007
BANK OF INDUSTRY,Development Finance Institutions,,,,,,,,,,,,,,,,,
Development Bank of Nigeria PLC,Development Finance Institutions,Development Bank of Nigeria PLC,Development Finance,-,-,01/01/1900,"Plot 1386A Tigris Crescent, Maitama, FCT Abuja",Maitama,ABU,+234 9 904 0000,-,-,-,-,NGN,Foreign and Domestic,RC 1215724,3/29/2017
FEDERAL MORTGAGE BANK OF NIGERIA,Development Finance Institutions,FEDERAL MORTGAGE BANK OF NIGERIA,Development Finance,-,-,11/06/2007,"Plot 266, Cadastral Zone A0, Central Business Dist",Abuja,ABU,09-2344212; 2344124; 2341677,-,-,01-2344213,"PMB 2273, Abuja",NGN,-,-,6/11/2007
NIGERIA EXPORT IMPORT BANK,Development Finance Institutions,,,,,,,,,,,,,,,,,
The Infrastructure Bank,Development Finance Institutions,,,,,,,,,,,,,,,,,
